{
  "$schema": "https://json-schema.org/draft/2020-12/schema",
  "type": "object",
  "properties": {
    "fit_score": {"type": "integer", "minimum": 0, "maximum": 100},
    "fit_verdict": {"type": "string"},
    "level": {"type": "integer", "minimum": 1, "maximum": 4},
    "level_name": {"type": "string"},
    "strongest_matches": {"type": "array", "items": {"type": "string"}},
    "major_gaps": {"type": "array", "items": {"type": "string"}},
    "sponsorship_risk": {"type": "string"},
    "summary": {"type": "string"},
    "decision": {"type": "string"}
  },
  "required": ["fit_score", "fit_verdict", "level", "level_name", "strongest_matches", "major_gaps", "sponsorship_risk", "summary", "decision"],
  "additionalProperties": false
}
