{"fit_score":62,"fit_verdict":"GOOD_FIT","level":2,"level_name":"Quick Apply","strongest_matches":["Strong overlap with AI product work through Pharmax, Haxaml, FRAME, and daily agent tooling, which maps well to an AI platform environment.","Good Python backend fit, with real professional experience at Vigilis plus backend and automation work in contract roles.","Relevant ML lifecycle exposure from HuggingFace, PyTorch, and RAGAS work, which supports the platform's data science and MLOps focus."],"major_gaps":["The role looks infrastructure-heavy, and there is no clear evidence of deep production Kubernetes ownership at scale.","No strong proof yet of hands-on Infrastructure as Code experience with Terraform or CloudFormation.","Faculty's platform work spans AWS, Azure, and GCP, and Arinze's public profile does not clearly show multi-cloud platform depth."],"sponsorship_risk":"low","summary":"Arinze is a good fit for the Software Engineer - Platform role at Faculty with a score of 62. The AI and Python alignment is real, but the role leans heavily on MLOps infrastructure, Kubernetes, IaC, and multi-cloud platform ownership, which makes this more of a stretch than a direct match.","decision":"completed"}